tweet_id,created_at,text,favorite_count,retweet_count,polarity,screen_name
985766308942925824,2018-04-16 06:26:17,Coldplay  Adventure Of A Lifetime,0,0,0.0,coldplay
985766302290767872,2018-04-16 06:26:15,Coldplay  Talk via,0,0,0.0,coldplay
985766234330484736,2018-04-16 06:25:59,RT  Even the kitty believes in Wakanda forever,0,3,0.0,coldplay
985766146510147584,2018-04-16 06:25:38,RT  Call it magic Call it true Call it magic When Im with you And I just got broken Broken into two Still I call it magic Whe…,0,13,0.17500000000000002,coldplay
985766124846542848,2018-04-16 06:25:33,RT  Run As One,0,896,0.0,coldplay
985766109872730112,2018-04-16 06:25:29,RT  Coldplay,0,48,0.0,coldplay
985766085134901248,2018-04-16 06:25:24,RT  Most humble super star i have met bless his soul,0,25,0.2111111111111111,coldplay
985766006495657984,2018-04-16 06:25:05,RT  Coldplay,0,91,0.0,coldplay
985765903227797505,2018-04-16 06:24:40,RT  Coldplay The Scientist,0,7,0.0,coldplay
985765763410608128,2018-04-16 06:24:07,Coldplay,0,0,0.0,coldplay
985765762139750400,2018-04-16 06:24:06,In the mood for Coldplay,0,0,0.0,coldplay
985765273536999426,2018-04-16 06:22:10,If you ever date meyou’ll need to get used to the fact that I listen Coldplay nonstop,0,0,0.0,coldplay
985765072327897088,2018-04-16 06:21:22,RT  Fermata Tracks 29 – Coldplay – Parachutes,0,1,0.0,coldplay
985764886922911745,2018-04-16 06:20:38,RT  time to spread the word about talent a few hours till VOID gets released heres a band named The Rose doing an amazing c…,0,368,0.3333333333333333,coldplay
985764750452772865,2018-04-16 06:20:05,Coldplay  Clocks,0,0,0.0,coldplay
985764644387094528,2018-04-16 06:19:40,RT  better late than never 🤷‍️ I’m giving away one Coldplay early entry gift from the European tour I’ll ship it to anywh…,0,172,0.07500000000000001,coldplay
985764641539321857,2018-04-16 06:19:39,RT  Day 5 RAIN Beer lunch Giggles Sore feet Coldplay MX Live 2012 God Put A Smile Upon Your…,0,1,0.21818181818181817,coldplay
985764403076362241,2018-04-16 06:18:42,RT  Coldplay,0,48,0.0,coldplay
985764394280906752,2018-04-16 06:18:40,RT  time to spread the word about talent a few hours till VOID gets released heres a band named The Rose doing an amazing c…,0,368,0.3333333333333333,coldplay
985764341491404800,2018-04-16 06:18:28,RT  You could never go wrong with some Coldplay,0,2,-0.5,coldplay
985764323883716610,2018-04-16 06:18:24,RT  Coldplay,0,91,0.0,coldplay
985764310868774914,2018-04-16 06:18:20,Estoy obsessed con coldplay ultimamente,0,0,-0.5,coldplay
985764297375731712,2018-04-16 06:18:17,RT  Coldplay  The scientist,0,4,0.0,coldplay
985764234737979393,2018-04-16 06:18:02,Fermata Tracks 29 – Coldplay – Parachutes,1,1,0.0,coldplay
985764184465043456,2018-04-16 06:17:50,RT  Coldplay,0,91,0.0,coldplay
985764037576110086,2018-04-16 06:17:15,RT  time to spread the word about talent a few hours till VOID gets released heres a band named The Rose doing an amazing c…,0,368,0.3333333333333333,coldplay
985763975706107905,2018-04-16 06:17:01,RT  s Viva La Vida album came out 10 years ago giving us iconic hits such as Lost Violet Hill Viva La Vi…,0,54,0.25,coldplay
985763965870452737,2018-04-16 06:16:58,RT  Coldplay,0,91,0.0,coldplay
985763921737822209,2018-04-16 06:16:48,Here’s a song for you… Everglow by Coldplay,0,0,0.0,coldplay
985763896807051264,2018-04-16 06:16:42,RT  Clocks Coldplay,0,3,0.0,coldplay
985763815232036864,2018-04-16 06:16:22,RT  This band is something else,0,4,0.0,coldplay
985763767467331585,2018-04-16 06:16:11,RT  The way Jonny looks at Chris is so soft My heart is melting,0,9,0.1,coldplay
985774830250287104,2018-04-16 07:00:08,Hey Guys Here is this weeks cover Dive EdSheeran hope you enjoy x,0,0,0.4,edsheeran
985774679649435648,2018-04-16 06:59:33,RT  MondayMotivation Success is the Best Revenge for Anything by Aziz Acharki,0,4,0.65,edsheeran
985773545463611392,2018-04-16 06:55:02,RT  Listen to my cover Perfect on JOOX JOOX Karaoke perfect music EdSheeran SongOfTheYear cov…,0,1,1.0,edsheeran
985773428538949632,2018-04-16 06:54:34,Listen to my cover Perfect on JOOX JOOX Karaoke perfect music EdSheeran SongOfTheYear coverartist,0,1,1.0,edsheeran
985772980654358528,2018-04-16 06:52:48,Perfect by  from SoundHound with LiveLyrics ®,0,0,1.0,edsheeran
985772281069817856,2018-04-16 06:50:01,Thats right his lasses minge is full of it,0,0,0.31785714285714284,edsheeran
985772106649620480,2018-04-16 06:49:19,Also you only need capital letters for the first letter of the word at the star…,0,0,0.125,edsheeran
985772065918611456,2018-04-16 06:49:09,RT  This is The A Team Dedicated fans camping out early to secure prime position for tomorrow night’s concert at …,0,4,0.25,edsheeran
985772059316846592,2018-04-16 06:49:08,Go To This Website a lot of FREE MONEY ON IT Free and Matched Bets Now edsheeran,0,0,0.4,edsheeran
985771939514978304,2018-04-16 06:48:39,He was episode 1 alone,0,0,0.0,edsheeran
985771696278900737,2018-04-16 06:47:41,There was no need for a question mark and you forgot a full stop at the end of the sentence,0,0,0.35,edsheeran
985771488031793152,2018-04-16 06:46:52,RT  I feel left out because and have a bond over olives,0,55812,0.0,edsheeran
985771396671225856,2018-04-16 06:46:30,RT  Ed Sheerans concert in Perth divide edsheeran perfect,0,18,1.0,edsheeran
985771370742276097,2018-04-16 06:46:24,my 2 year old boy singing perfect,0,0,0.55,edsheeran
985771358822027264,2018-04-16 06:46:21,RT  I feel left out because and have a bond over olives,0,55812,0.0,edsheeran
985771275111956481,2018-04-16 06:46:01,RT  60000 Perth fans at Ed Sheeran’s first show of his Australian tour last night perthnews,0,1,0.08333333333333333,edsheeran
985771152692973568,2018-04-16 06:45:32,RT  Just had a dream that I was at Coachella2018 as ‘s back up dancer I don’t think he even has dancers was gu…,0,1,0.0,edsheeran
985770914548662272,2018-04-16 06:44:35,RT  Ed sheeran divide  Perth WA EdSheeran edsheeranperth edsheerandivide perthnow perthnews,0,1,0.0,edsheeran
985770857996800002,2018-04-16 06:44:21,RT  Whatever ye think about for a man to stand in front of 60000 people on his own takes balls aswell as talentgreat…,0,2,0.6,edsheeran
985770751851610113,2018-04-16 06:43:56,RT  My favourite song on the album EdSheeran perth,0,4,0.0,edsheeran
985770650722713600,2018-04-16 06:43:32,RT  Ed Sheerans concert in Perth divide edsheeran castleonthehill,0,3,0.0,edsheeran
985770461630873600,2018-04-16 06:42:47,RT  Ed Sheeran Perth Best Performance EdSheeran EdSheeranDivide edsheeranperth perthnow perthnews …,0,1,1.0,edsheeran
985770339362893824,2018-04-16 06:42:18,RT  9 ▪ talking about Harrys album It really shows him off as an artist and as a singer Its what it was a…,0,64,0.2,edsheeran
985769870188056578,2018-04-16 06:40:26,NowPlaying Shape of You by ON,0,0,0.0,edsheeran
985769824247734272,2018-04-16 06:40:15,RT  RIVER BEHIND THE SCENES MIDNIGHT EST PHOTO,0,2055,-0.4,edsheeran
985769656358027264,2018-04-16 06:39:35,cover Perfect by,0,0,1.0,edsheeran
985769655011700736,2018-04-16 06:39:35,RT  You can’t take Ed anywhere man The guy is just destructive RIVER BTS,0,4719,-0.6,edsheeran
985769154899668997,2018-04-16 06:37:35,RT  This Feb marked my 10th year of working with EdSheeran To celebrate this in style I joined forces with Eds dad Jo…,0,1217,0.1,edsheeran
985768623133339648,2018-04-16 06:35:29,Yer I did,1,0,0.0,edsheeran
985768415003578368,2018-04-16 06:34:39,RT  This Feb marked my 10th year of working with EdSheeran To celebrate this in style I joined forces with Eds dad Jo…,0,1217,0.1,edsheeran
985768012807536640,2018-04-16 06:33:03,RT  Happy MusicMonday …,0,2,0.8,edsheeran
985767870075256832,2018-04-16 06:32:29,RT  Music to our ears We cant enough of GRAMMY winner s stunning performance of Candle In The Wind ️️ A tr…,0,224,0.25,edsheeran
985767736004530176,2018-04-16 06:31:57,RT  Tonight at midnight eastern EndGameMusicVideo,0,43979,0.0,edsheeran
985767722230468608,2018-04-16 06:31:54,RT  EndGameMusicVideo out now,0,32038,0.0,edsheeran
985766230966657025,2018-04-16 06:25:58,Did you also dream you were sucking ed off after the show is his motor home,0,0,0.0,edsheeran
985766085990453248,2018-04-16 06:25:24,RT  PremiosMTVMIAW MTVBRFANDOMSHEERIOS EdSheeran RT to vote,0,3,0.0,edsheeran
985765807258062848,2018-04-16 06:24:17,RT  Crying bc and I met exactly 4 years ago,0,1,0.024999999999999994,edsheeran
985765805798412288,2018-04-16 06:24:17,You must eat too much 🧀🧀🧀 at night dude,0,0,0.2,edsheeran
985765737993302017,2018-04-16 06:24:01,Nowplaying Perfect by MondayMorningwith,0,0,1.0,edsheeran
985765069962096640,2018-04-16 06:21:21,hello sir I am from India big fan of yours I have written a few songs I really wana show em to you…,0,0,0.0,edsheeran
985764976894861312,2018-04-16 06:20:59,Just had a dream that I was at Coachella2018 as ‘s back up dancer I don’t think he even has dancers …,74,1,0.0,edsheeran
985764363452678144,2018-04-16 06:18:33,NP ft Perfect Duet R2BreakfastShow w  StarterMonday,0,0,1.0,edsheeran
985764264991444992,2018-04-16 06:18:10,RT  New week New opportunities More possibilities PositiveVibesOnly On Air with amp NP  RIVE…,0,2,0.25757575757575757,edsheeran
985763231947001857,2018-04-16 06:14:03,Loving it ChrisBrown lildicky edsheeran djkhalled kendaljener,0,0,0.6,edsheeran
985762818853974016,2018-04-16 06:12:25,RT  Top 10 On Billboard Artist 100 1 2 3 4 5 6 7 …,0,9619,0.5,edsheeran
985762660561182720,2018-04-16 06:11:47,We have nothing on for the Vamps Rach JC,0,0,0.0,edsheeran
985762382029844481,2018-04-16 06:10:41,RT  This Feb marked my 10th year of working with EdSheeran To celebrate this in style I joined forces with Eds dad Jo…,0,1217,0.1,edsheeran
985762315139137537,2018-04-16 06:10:25,RT  This Feb marked my 10th year of working with EdSheeran To celebrate this in style I joined forces with Eds dad Jo…,0,1217,0.1,edsheeran
985761731229073408,2018-04-16 06:08:05,Security fence,0,0,0.0,edsheeran
985761486776799232,2018-04-16 06:07:07,RT  Inner came out FilayyyyMovement,0,412,0.0,edsheeran
985761460289617921,2018-04-16 06:07:01,Can you see official i…,0,0,0.0,edsheeran
985761279506657281,2018-04-16 06:06:18,Still shes number 9,0,0,0.0,edsheeran
985760974824136705,2018-04-16 06:05:05,lagisetel  Thingking Out Loud maksi with 1032fm I,0,0,0.1,edsheeran
985760676701507584,2018-04-16 06:03:54,RT  This Feb marked my 10th year of working with EdSheeran To celebrate this in style I joined forces with Eds dad Jo…,0,1217,0.1,edsheeran
985760558870740992,2018-04-16 06:03:26,Still looking for kev,0,0,0.0,edsheeran
985760482668793856,2018-04-16 06:03:08,RT  New week New opportunities More possibilities PositiveVibesOnly On Air with amp NP  RIVE…,0,2,0.25757575757575757,edsheeran
985760331489337344,2018-04-16 06:02:32, i play guitar every day,0,0,0.0,edsheeran
985759416543674368,2018-04-16 05:58:54,RT  I love you  And I dream to see and hear you perform Lego House live My favourite song of yours Sadly TeamFBL…,0,3714,0.04545454545454545,edsheeran
985758014404726784,2018-04-16 05:53:19,RT  PremiosMTVMIAW MTVBRFANDOMSHEERIOS EdSheeran RT to vote,0,3,0.0,edsheeran
985757565580709888,2018-04-16 05:51:32,RT  This Feb marked my 10th year of working with EdSheeran To celebrate this in style I joined forces with Eds dad Jo…,0,1217,0.1,edsheeran
985757406557818881,2018-04-16 05:50:54,RT  OnAir  The AWESOME duo of and on MaxBreakfast powered by KelloggsCornflakes NPEnd Game  …,0,1,0.3,edsheeran
985757232267759616,2018-04-16 05:50:13,RT  This Feb marked my 10th year of working with EdSheeran To celebrate this in style I joined forces with Eds dad Jo…,0,1217,0.1,edsheeran
985756929220796416,2018-04-16 05:49:01,OnAir  The AWESOME duo of and on MaxBreakfast powered by KelloggsCornflakes NPEnd…,0,1,1.0,edsheeran
985756797645438976,2018-04-16 05:48:29,RT  WHAT DO I KNOW  full video,0,2664,0.35,edsheeran
985755862307344384,2018-04-16 05:44:46,RT  Pop up giveaway 5 months til returns to GilletteStadium amp weve got your chance to win your way in…,0,1155,0.8,edsheeran
985755502914158592,2018-04-16 05:43:21,NP  Galway Girl TIPS,0,0,0.0,edsheeran
985755383401734144,2018-04-16 05:42:52,RT  this is legendary a true gentlemen,0,30690,0.675,edsheeran
985754744558780416,2018-04-16 05:40:20,Wish I could come to the concert but I have school and I live to far,0,0,0.11818181818181818,edsheeran
985754695208665088,2018-04-16 05:40:08,Happy Monday Its time to get HeartBreakfast on your radio  amp all pl…,1,0,0.8,edsheeran
985754512320335874,2018-04-16 05:39:24,RT  Perfect I’ll be posting every Sunday at 830pm Any song suggestions just comment 🤘🤘,0,16,1.0,edsheeran
985753469830213632,2018-04-16 05:35:16,RT  Hot Play thinking out loud on the KoffeeGang GetUp with amp,0,2,0.175,edsheeran
985753139168063488,2018-04-16 05:33:57,RT  This Feb marked my 10th year of working with EdSheeran To celebrate this in style I joined forces with Eds dad Jo…,0,1217,0.1,edsheeran
985752967084208129,2018-04-16 05:33:16,RT  Happy MusicMonday …,0,2,0.8,edsheeran
985752479550799873,2018-04-16 05:31:20,RT  This Feb marked my 10th year of working with EdSheeran To celebrate this in style I joined forces with Eds dad Jo…,0,1217,0.1,edsheeran
985752331827535872,2018-04-16 05:30:44,India Tour covered in our March Editionlink as below Buy your copy to read…,0,0,0.0,edsheeran
985752218333863936,2018-04-16 05:30:17,Ed Sheeran in Talks for Danny Boyle and Richard Curtis Film DannyBoyle RichardCurtis EdSheeran,0,0,0.0,edsheeran
985752206266785793,2018-04-16 05:30:15,RT  Hot Play thinking out loud on the KoffeeGang GetUp with amp,0,2,0.175,edsheeran
985751445503926272,2018-04-16 05:27:13,RT  Both and will be supporting on his recordbreaking UK stadium tour Get your tickets now…,0,2,0.25,edsheeran
985751252729507840,2018-04-16 05:26:27,NowPlaying “Thinking Out Loud” by on Anghami Im thinking bout how people…,0,0,0.1,edsheeran
985751198094581760,2018-04-16 05:26:14,RT  This Feb marked my 10th year of working with EdSheeran To celebrate this in style I joined forces with Eds dad Jo…,0,1217,0.1,edsheeran
985751195321909249,2018-04-16 05:26:13,RT  Pop up giveaway 5 months til returns to GilletteStadium amp weve got your chance to win your way in…,0,1155,0.8,edsheeran
985751192579067904,2018-04-16 05:26:13,RT  This Feb marked my 10th year of working with EdSheeran To celebrate this in style I joined forces with Eds dad Jo…,0,1217,0.1,edsheeran
985750562544041984,2018-04-16 05:23:43,Listening to s ÷ album,2,0,0.0,edsheeran
985750165335302144,2018-04-16 05:22:08,Hot Play thinking out loud on the KoffeeGang GetUp with amp,0,2,0.175,edsheeran
985749742603898880,2018-04-16 05:20:27,NowPlaying Perfect Lord N Remi by on,0,0,1.0,edsheeran
985749726560751618,2018-04-16 05:20:23,Shape of You Morningspice WakeyWakey,0,0,0.0,edsheeran
985749642649288705,2018-04-16 05:20:03,RT  The A Team  RT if you like it,0,4,0.0,edsheeran
985749267318038528,2018-04-16 05:18:34,New week New opportunities More possibilities PositiveVibesOnly On Air with amp N…,0,2,0.25757575757575757,edsheeran
985748939579281409,2018-04-16 05:17:16,Lets go together,0,0,0.0,edsheeran
985748936970330112,2018-04-16 05:17:15,RT  WHAT DO I KNOW  full video,0,2664,0.35,edsheeran
985748782313820160,2018-04-16 05:16:38,RT  Good for you Ed Extra protection Who needs the aggravation especially when your gonna have a family…,0,1,0.2333333333333333,edsheeran
985747854076596224,2018-04-16 05:12:57,Lumiere over me dividetourmnl MOA Concert Grounds,0,0,0.0,edsheeran
985774613392175104,2018-04-16 06:59:17,RT  New song by the amazing incomparable A Good Night is off the charts Beyond amazing  so hooked  addicted leg…,0,4,0.3393939393939394,johnlegend
985774573248503809,2018-04-16 06:59:07,RT  New song by the amazing incomparable A Good Night is off the charts Beyond amazing  so hooked  addicted leg…,0,4,0.3393939393939394,johnlegend
985774383875620865,2018-04-16 06:58:22,RT  New song by the amazing incomparable A Good Night is off the charts Beyond amazing  so hooked  addicted leg…,0,4,0.3393939393939394,johnlegend
985774113019981824,2018-04-16 06:57:17,dont you ever do this to me,0,0,0.0,johnlegend
985773828411478016,2018-04-16 06:56:10,and are actual goals️,0,0,0.0,johnlegend
985773549406375936,2018-04-16 06:55:03,RT  My mama is getting married on October 20 2018 and she’s finally found the love of her life  I’ve…,0,19,0.25,johnlegend
985773110711537666,2018-04-16 06:53:19,NP AGoodNight BY GoodmorningNigeriashowWithMandK x MONDAYMUSICLIVE…,2,0,0.0,johnlegend
985771079712075777,2018-04-16 06:45:14,RT  The Stellenbosch University Choir performance s All of Me and its heartbreakingly beautiful,0,10,0.85,johnlegend
985771058841182209,2018-04-16 06:45:09,I was thinking the same thing,0,0,0.0,johnlegend
985770180398796800,2018-04-16 06:41:40,RT  25 ▪ on Harrys songwriting skills amp writing a song together He has some really good lyrical ideas ht…,0,49,0.7,johnlegend
985769431480418304,2018-04-16 06:38:41,RT  My mama is getting married on October 20 2018 and she’s finally found the love of her life  I’ve…,0,19,0.25,johnlegend
985768256223891456,2018-04-16 06:34:01,RT  Bittersweet to hear because of George but also so beautiful is making ‘Don’t Let The Sun Go Down On Me’ his…,0,215,0.3472222222222222,johnlegend
985767270780678144,2018-04-16 06:30:06,RT   is spectacular This was a good day for a good night,0,835,0.6666666666666666,johnlegend
985767206188437506,2018-04-16 06:29:51,RT  I asked WhoBitBeyonce,0,432,0.0,johnlegend
985766828772417536,2018-04-16 06:28:21,Alright we gotta protect amp at all costs at this point cause this separating shit is g…,1,0,-0.2,johnlegend
985765975806173185,2018-04-16 06:24:57,Todays Daily Abstraction 218041601 Green Light JohnLegend abstractart,0,0,0.06666666666666667,johnlegend
985765799213219840,2018-04-16 06:24:15,What would I do without your smart mouth drawing me in and you kicking me out johnlegend lyrics followme followback,0,0,0.21428571428571427,johnlegend
985763881497788417,2018-04-16 06:16:38,RT to help me meettake to dinner Help a girl out🤣Let’s see the power of the internetit did help yodel bo…,1,0,0.0,johnlegend
985762627568721920,2018-04-16 06:11:39,On your radio  Now Playing x  A Good Night w RYSENSHYNE,0,0,0.7,johnlegend
985762571021176832,2018-04-16 06:11:26,RT   is spectacular This was a good day for a good night,0,835,0.6666666666666666,johnlegend
985762428691640320,2018-04-16 06:10:52,On your radio  Now Playing x x  A Good Night w RYSENSHYNE,1,0,0.7,johnlegend
985760615644905472,2018-04-16 06:03:39,Try to meet and hear from ASU President  He’s a true…,0,0,0.0,johnlegend
985759383383666688,2018-04-16 05:58:46,RT   will join costar on April 19th for an indepth conversation as part of Tribeca Tal…,0,10,0.0,johnlegend
985759202038697984,2018-04-16 05:58:02,RT   is spectacular This was a good day for a good night,0,835,0.6666666666666666,johnlegend
985757985837268992,2018-04-16 05:53:12,Well done Cant get enough have watched it 5 times,0,0,0.0,johnlegend
985757376841121799,2018-04-16 05:50:47,RT  My mama is getting married on October 20 2018 and she’s finally found the love of her life  I’ve…,0,19,0.25,johnlegend
985757249565069312,2018-04-16 05:50:17,Protect  and  at all costs,0,0,0.0,johnlegend
985757176860848128,2018-04-16 05:50:00,Great job,0,0,0.8,johnlegend
985756919863193601,2018-04-16 05:48:58,Just want to tell you how much we enjoyed your performance in JCS The band were killing it and the ca…,0,0,0.5,johnlegend
985756817476038656,2018-04-16 05:48:34,RT  Everyone keeps saying my baby looks like Thankful to have you in my life love you sonshine MAW,0,2,0.5,johnlegend
985756427011604480,2018-04-16 05:47:01,RT  LipSyncBattle  JohnLegend amp StevieWonder Live ⬇️ ⬇️ ⬇️ ️️,0,30,0.13636363636363635,johnlegend
985755658082385920,2018-04-16 05:43:57,I’d give up on life tbh,1,0,0.0,johnlegend
985754886804557824,2018-04-16 05:40:54,Anyone else still bump Green Light by amp André 3000 ⁉️,1,0,0.1,johnlegend
985754103698612224,2018-04-16 05:37:47,RT  sundayvibes johnlegend ALL OF ME LOVE ALL OF YOU and this is how I see life,0,0,0.5,johnlegend
985753907119861760,2018-04-16 05:37:00,Where did u hear this,0,0,0.0,johnlegend
985753666585071621,2018-04-16 05:36:03,RT  My mama is getting married on October 20 2018 and she’s finally found the love of her life  I’ve…,0,19,0.25,johnlegend
985752124964274177,2018-04-16 05:29:55,I just want and to adopt me Is that too much to ask for,1,0,0.2,johnlegend
985749328315731968,2018-04-16 05:18:48,RT  My mama is getting married on October 20 2018 and she’s finally found the love of her life  I’ve…,0,19,0.25,johnlegend
985749019002535936,2018-04-16 05:17:35,RT  Your spring bop has arrived My new single AGoodNight feat is out now,0,547,0.032467532467532464,johnlegend
985748302133190656,2018-04-16 05:14:44,RT  Multihyphenate artists and Sara Bareilles are coming to Tribeca2018 for an indepth conversation about storytell…,0,11,0.0,johnlegend
985745789266857984,2018-04-16 05:04:45,RT  All of me by still touches,0,20,0.0,johnlegend
985745634815754240,2018-04-16 05:04:08,RT  Is that tiny kitchen food behind ,0,31,-0.2,johnlegend
985744797309616128,2018-04-16 05:00:48,RT   will join costar on April 19th for an indepth conversation as part of Tribeca Tal…,0,10,0.0,johnlegend
985744562000973824,2018-04-16 04:59:52,RT  LipSyncBattle  JohnLegend amp StevieWonder Live ⬇️ ⬇️ ⬇️ ️️,0,30,0.13636363636363635,johnlegend
985744190549233669,2018-04-16 04:58:23,Damn now and Nikki Bella broke up man I was hoping it was fake news but damn love just isnt…,0,0,0.0,johnlegend
985744176389246976,2018-04-16 04:58:20,RT  My mama is getting married on October 20 2018 and she’s finally found the love of her life  I’ve…,0,19,0.25,johnlegend
985742589528649733,2018-04-16 04:52:02,RT  Is that tiny kitchen food behind ,0,31,-0.2,johnlegend
985742568255315968,2018-04-16 04:51:57,RT  My mama is getting married on October 20 2018 and she’s finally found the love of her life  I’ve…,0,19,0.25,johnlegend
985742043250016256,2018-04-16 04:49:51,With all the breakups in 2018 and need to stay together for my soul,0,0,0.0,johnlegend
985742029090185216,2018-04-16 04:49:48,i honestly cant handle all these celebrity couples breaking up lately but if and ever sp…,1,0,0.15,johnlegend
985741225855766528,2018-04-16 04:46:37,RT  LipSyncBattle  JohnLegend amp StevieWonder Live ⬇️ ⬇️ ⬇️ ️️,0,30,0.13636363636363635,johnlegend
985741108285267969,2018-04-16 04:46:09,RT  LipSyncBattle  JohnLegend amp StevieWonder Live ⬇️ ⬇️ ⬇️ ️️,0,30,0.13636363636363635,johnlegend
985741042199674880,2018-04-16 04:45:53,What a true fan She is absolutely adorable,0,0,0.425,johnlegend
985740655036194816,2018-04-16 04:44:20,RT  My mama is getting married on October 20 2018 and she’s finally found the love of her life  I’ve…,0,19,0.25,johnlegend
985740011269046272,2018-04-16 04:41:47,RT  LipSyncBattle  JohnLegend amp StevieWonder Live ⬇️ ⬇️ ⬇️ ️️,0,30,0.13636363636363635,johnlegend
985739404462444545,2018-04-16 04:39:22,is the lucky one,0,0,0.3333333333333333,johnlegend
985739333352218624,2018-04-16 04:39:05,RT  NP All of me 2FMBreakfast,0,1,0.0,johnlegend
985738533171167232,2018-04-16 04:35:55,RT  Is that tiny kitchen food behind ,0,31,-0.2,johnlegend
985738503605583872,2018-04-16 04:35:48,RT  um and are still together so yes there is but they are our only hope,0,1,0.0,johnlegend
985738470978211841,2018-04-16 04:35:40,RT  My mama is getting married on October 20 2018 and she’s finally found the love of her life  I’ve…,0,19,0.25,johnlegend
985737170563543042,2018-04-16 04:30:30,RT  My mama is getting married on October 20 2018 and she’s finally found the love of her life  I’ve…,0,19,0.25,johnlegend
985736771853053952,2018-04-16 04:28:55,RT  JohnLegend inducting DrJohn into the RockHall 2011 Getty Photo by Jim Spellman  WireImage,0,27,0.0,johnlegend
985736393560330241,2018-04-16 04:27:24,RT  Wish I can work with ,0,61,0.0,johnlegend
985736229051424768,2018-04-16 04:26:45,RT   is spectacular This was a good day for a good night,0,835,0.6666666666666666,johnlegend
985735746677084161,2018-04-16 04:24:50,RT  My mama is getting married on October 20 2018 and she’s finally found the love of her life  I’ve…,0,19,0.25,johnlegend
985734000160407552,2018-04-16 04:17:54,First amp Chris Pratt  then amp  Next thing you know we’re g…,0,0,0.125,johnlegend
985733663643062272,2018-04-16 04:16:34,um and are still together so yes there is but they are our only hope,0,1,0.0,johnlegend
985733367587942401,2018-04-16 04:15:23,Now play on  All of me,0,0,0.0,johnlegend
985733286529060866,2018-04-16 04:15:04,RT  My mama is getting married on October 20 2018 and she’s finally found the love of her life  I’ve…,0,19,0.25,johnlegend
985733260637589504,2018-04-16 04:14:58,RT  Is that tiny kitchen food behind ,0,31,-0.2,johnlegend
985733157667377152,2018-04-16 04:14:33,RT  My mama is getting married on October 20 2018 and she’s finally found the love of her life  I’ve…,0,19,0.25,johnlegend
985733150109122560,2018-04-16 04:14:31,MPlays ft  Penthouse Floor MaxiBreak w Renita 988MPoweringYou,0,0,0.0,johnlegend
985733125312532481,2018-04-16 04:14:25,RT  My mama is getting married on October 20 2018 and she’s finally found the love of her life  I’ve…,0,19,0.25,johnlegend
985732818444652544,2018-04-16 04:13:12,My mother is in the living room absolutely pissed off that she couldn’t get tickets to the concert I’m…,0,0,0.2,johnlegend
985732296358744064,2018-04-16 04:11:08,Whenever I see a couple that I thought was THAT couple split up be they family friends or random celebrities…,6,0,-0.5,johnlegend
